0,1,2,3,4,5,6
我が身を抓って人の痛さを知れ,わがみをつねってひとのいたさをしれ,exp proverb,,1,you can't appreciate others' suffering until you've gone through it yourself pinch oneself and know others' pain,2416830
我に返る,われにかえる,exp v5r,v5,5,to come to one's senses,2125250
我の強い,がのつよい,exp adj-i,adj-i,3,egoistic selfish self-willed,2238490
我を出す,がをだす,exp v5s,v5,1,to insist on one's own ideas,1196740
我を張る,がをはる,exp v5r,v5,3,to insist on one's own ideas,1196760
我を忘れる,われをわすれる,exp v1,v1,4,to forget oneself to lose control of oneself,2037240
我を折る,がをおる,exp v5r,v5,3,to concede a point to yield to give in,1196750
我を立てる,がをたてる,exp v1,v1,2,to insist on one's own ideas,1196780
我を通す,がをとおす,exp v5s,v5,4,to insist on one's own ideas to have one's own way,1196770
我心,わがこころ,exp n,,1,my heart,1196850
我思う故に我在り,われおもうゆえにわれあり,exp,,1,"I think, therefore I am",2164860
我慢しないで,がまんしないで,exp,,2,without restraint without hesitation without holding back,2513720
我関せず,われかんせず,exp,,2,no concern of mine nothing to do with me,2068430
戒を破る,かいをやぶる,exp v5r,v5,1,to break the Buddhist commandments,1864120
或いは,あるいは,adv conj exp uk,,610,or possibly,1586850
戦いを挑む,たたかいをいどむ,exp v5m,v5,1,to challenge (a person) to a fight,1891260
戦えば乃ち勝つ,たたかえばすなわちかつ,exp v5t obsc,v5,1,to win every battle (that is fought) to be ever victorious,1891270
戦端を開く,せんたんをひらく,exp v5k,v5,2,to open hostilities to take up arms (against),1888970
戸を破る,とをやぶる,exp v5r,v5,3,to bust down a door to break a door open,1898120
戸を立てる,とをたてる,exp v1,v1,2,to shut a door,1898110
戸を開ける,とをあける,exp v1,v1,3,to open the door,1898100
戻ってくる,もどってくる,exp vk,vk,2,to come back,2092960
所では,ところでは,exp uk,,3,so far as,1897510
所により,ところにより,exp uk,,2,in places,2759050
所へ,ところへ,exp uk,,1,thereupon shortly thereafter,2097010
所を替える,ところをかえる,exp v1,v1,2,to change sides to change places,1897520
所変われば品変わる,ところかわればしなかわる,exp id,,2,"So many countries, so many customs",2417890
所嫌わず,ところきらわず,exp adv,,4,anywhere everywhere indiscriminate(ly) no matter where,1661690
所帯を持つ,しょたいをもつ,exp v5t,v5,2,to keep a house to run a household,2403040
所構わず,ところかまわず,exp adv uk,,3,irrespective of the occasion indiscriminately,1854600
所為か,せいか,exp uk,,1,it may be because,2026700
所為にする,せいにする,exp vs-i uk,vs,2,to lay the blame on to put the fault on,2202970
所要時間を計る,しょようじかんをはかる,exp v5r,v5,1,to calculate the time required,1883420
手あかの付いた,てあかのついた,exp adj-f,,1,worn-out (e.g. joke) stale hackneyed,2832745
手がつけられない,てがつけられない,exp adj-i,adj-i,2,out of control out of hand unmanageable,2766770
手がない,てがない,exp adj-i,adj-i,3,not having enough workers being understaffed being undermanned,2767920
手が上がる,てがあがる,exp v5r,v5,2,to improve one's skill (esp. at calligraphy or drinking larger amounts of alcohol),1854430
手が出ない,てがでない,exp adj-i,adj-i,4,out of one's reach beyond one's grasp,2603750
手が出る,てがでる,exp v1,v1,4,to jab to swing at a bad ball (baseball),2620820
手が切れる,てがきれる,exp v1,v1,3,to break off with (e.g. one's lover),2592120
手が利く,てがきく,exp v5k,v5,2,to be able to be competent,2614770
手が塞がる,てがふさがる,exp v5r,v5,1,to be busy to be tied up doing something,2276780
手が届く,てがとどく,exp v5k,v5,5,to be able to reach to be within one's reach to be able to afford to have the means to buy,2400050
手が後ろに回る,てがうしろにまわる,exp v5r,v5,2,to have one's hands tied behind one to be arrested,2125820
手が悪い,てがわるい,exp adj-i,adj-i,1,unscrupulous,2754970
手が掛かる,てがかかる,exp v5r,v5,2,to take a lot of dealing with to be a handful,2089710
手が早い,てがはやい,exp,,5,to be a quick worker,2089780
手が混む,てがこむ,exp v5m,v5,1,to be intricate to be elaborate to be complicated to be complex,2159200
手が滑る,てがすべる,exp v5r,v5,1,to have one's hands slip (and drop something),2399520
手が空く,てがあく,exp v5k,v5,2,to be free to be available,2093080
手が足りない,てがたりない,exp adj-i,adj-i,2,short of hands,1895430
手が離せない,てがはなせない,exp adj-i,adj-i,2,having to continue doing the work at hand right in the middle of something,2125840
手が離れる,てがはなれる,exp v1,v1,1,to leave one's hands to leave one's possession,2721980
手ぐすね引く,てぐすねひく,exp v5k,v5,4,to be ready and waiting for to be on the alert for,2121110
手っ取り早く言えば,てっとりばやくいえば,exp,,2,in a word to put it briefly to make a long story short,2118820
手にかける,てにかける,exp v1,v1,9,to take care of to bring up under one's personal care,2803280
手にする,てにする,exp vs-i,vs,6,to hold (in one's hand) to take (into one's hand),2266810
手に乗る,てにのる,exp v5r,v5,3,to be fooled by something to be taken in,2082890
手に付かない,てにつかない,exp,,2,"to not be able to concentrate on (due to distractions, etc.)",2202960
手に余る,てにあまる,exp v5r,v5,3,to be beyond one's capacities to be beyond one's powers to be beyond one's control to be unmanageable,1895820
手に入る,てにはいる,exp v5r,v5,605,to obtain to come into possession of to get hold of to get one's hands on,1327220
手に入れる,てにいれる,exp v1 vt,v1,608,to obtain to procure,1327230
手に取る,てにとる,exp v5r,v5,2,to take in one's hand to pick up to obtain,1895840
手に取るように,てにとるように,exp,,2,quite clearly quite distinctly perfectly exactly,2794080
手に手に,てにてに,exp,,3,each (carrying),2662900
手に掛かる,てにかかる,exp v5r vi,v5,2,to fall into someone's hands to place oneself in someone's power,2777730
手に汗を握る,てにあせをにぎる,exp v5r,v5,3,to sit on the edge of one's seat to be in breathless suspense,2117950
手に渡る,てにわたる,exp v5r,v5,2,to fall into someone's hands to pass into another's possession,2830259
手に職をつける,てにしょくをつける,v1 vt exp,v1,2,to acquire a trade to learn a vocation,2801980
手に職をもつ,てにしょくをもつ,exp v5t,v5,1,to have a trade to have a vocation,2826586
手に落ちる,てにおちる,exp v1,v1,2,to fall into (someone's) hands to fall under someone's control to become someone's property (e.g. of an object),1904380
手に負えない,てにおえない,exp adj-i,adj-i,3,spoiled unmanageable uncontrollable incorrigible obstreperous,2084650
手のかかる,てのかかる,exp adj-f,,3,"troublesome difficult (e.g. customer, guest, child) laborious (e.g. task, dinner)",2527000
手のつけられない,てのつけられない,exp adj-i,adj-i,2,out of control out of hand unmanageable,2827163
手のひらを返す,てのひらをかえす,exp v5s,v5,5,to change one's attitude quickly,2068440
手の内を見せる,てのうちをみせる,exp v1 id,v1,3,to reveal one's true intentions to show one's cards,2125850
手の届かない所,てのとどかないところ,exp,,1,(a place) out of one's reach,2400060
手の施しようがない,てのほどこしようがない,exp,,2,beyond help there's nothing that can be done,2125830
手の腹,てのはら,exp n,,1,palm (of one's hand),2728260
手も足も出ない,てもあしもでない,exp,,2,cannot do a thing feeling handcuffed being at the end of one's tether being at one's wit's end,2117970
手をかける,てをかける,exp v1,v1,7,to lay hands on to touch,2528250
手をこまねく,てをこまねく,exp v5k,v5,5,to fold one's arms to stand and watch (without interfering),2267430
手をつける,てをつける,exp v1,v1,12,to set one's hand to to start work on,2222160
手を下す,てをくだす,exp v5s,v5,3,to do oneself to do by oneself,2394490
手を休める,てをやすめる,exp v1,v1,2,"to rest (from work, studying, etc.) to take a break",2832092
手を借りる,てをかりる,exp v1 id,v1,2,to accept help to get help to ask for help,2759410
手を入れる,てをいれる,exp v1,v1,3,to correct to touch up to smarten up,2798690
手を出す,てをだす,exp v5s,v5,9,to turn one's hand to to reach out one's hand,1896030
手を切る,てをきる,exp v5r,v5,4,to cut off (a relationship),1327280
手を加える,てをくわえる,exp v1,v1,3,to perform some process to apply some treatment,2120300
手を取る,てをとる,exp v5r,v5,2,to take someone's hand,2402970
手を叩く,てをたたく,exp v5k,v5,3,to clap,1327300
手を回す,てをまわす,exp v5s,v5,3,to make the necessary preparations in secret,2573880
手を変える,てをかえる,exp v1,v1,2,to resort to other means,1895960
手を変え品を変え,てをかえしなをかえ,exp adv id,,2,by hook or by crook by all possible means,1895950
手を尽くす,てをつくす,exp v5s,v5,2,to try all possible means,2184570
手を差し伸べる,てをさしのべる,exp v1,v1,1,to lend a hand to give a hand to help to extend a helping hand,1895990
手を延べる,てをのべる,exp v1,v1,1,to extend one's arm to reach out to offer one's hand,1896070
手を引く,てをひく,exp v5k,v5,6,to withdraw from (a deal) to wash one's hands of,1896080
手を打つ,てをうつ,exp v5t,v5,6,to take measures (in face of events being anticipated),2200440
手を抜く,てをぬく,exp v5k,v5,4,to ease up (on an opponent) to cut corners to be shoddy,1327310
手を挙げる,てをあげる,exp v1,v1,6,to raise one's hand or hands,2210610
手を振る,てをふる,exp v5r,v5,4,to wave one's hand,1896090
手を携えて,てをたずさえて,exp,,3,hand in hand,1896020
手を支える,てをつかえる,exp v1,v1,1,"to place both hands on the ground (to express respect, apology or to present a request)",2660800
手を束ねて,てをつかねて,exp,,1,doing nothing folding one's arms,1896040
手を染める,てをそめる,exp v1,v1,3,to get involved (with) to begin (with) to have a hand (in),1896010
手を汚す,てをよごす,exp v5s,v5,2,to dirty one's hands,2401840
手を焼かせる,てをやかせる,exp v1,v1,1,to bother to embarrass to harass to give someone a hard time to give someone a lot of trouble,2793120
手を焼く,てをやく,exp v5k,v5,2,not know what to do with to be at a loss with to have difficulty with to be put out,2028670
手を煩わす,てをわずらわす,exp v5s,v5,2,to cause a person trouble,2572480
手を煩わせる,てをわずらわせる,exp v1,v1,2,to cause a person trouble,2399490
手を空かす,てをすかす,exp v5s,v5,1,to make oneself available,1896000
手を突く,てをつく,exp v5k,v5,3,"to place both hands on the ground (to express respect, apology or to present a request)",2583530
手を組む,てをくむ,exp v5m,v5,4,to join hands together,1895980
手を結ぶ,てをむすぶ,exp v5b,v5,3,to join hands,1896110
手を繋ぐ,てをつなぐ,exp v5g,v5,3,to join hands (with),1896060
手を貸す,てをかす,exp v5s id,v5,3,to lend a hand to help,2126990
手を離れる,てをはなれる,exp v1,v1,4,to become independent,2402990
手中におさめる,しゅちゅうにおさめる,exp v1,v1,2,to make one's own to take possession of,2400040
手中にする,しゅちゅうにする,exp vs-i,vs,1,to get hold of to take possession of to seize,1328130
手付けを打つ,てつけをうつ,exp v5t,v5,1,to advance money (on a contract),1895750
手元が狂う,てもとがくるう,exp v5u,v5,3,to become clumsy to miss one's aim,2589720
手入らず,ていらず,exp adj-no,,7,requiring little trouble untouched,1698370
手刀を切る,てがたなをきる,exp v5r sumo,v5,2,to make a ceremonial hand movement when receiving the monetary award,2024370
手前の方,てまえのほう,exp,,2,this side in the forefront,1328040
手動による,しゅどうによる,exp adj-f,,2,manually powered manual,2362570
手取り足取り,てとりあしとり,exp adv,,5,attentively with great attention to detail (e.g. when teaching) patiently,2068420
手塩に掛ける,てしおにかける,exp v1,v1,3,to bring up under one's personal care,2104170
手底の玉,たなそこのたま,exp n,,1,apple of one's eye,2827978
手当たり次第,てあたりしだい,adv exp,,706,using anything one can lay one's hands on haphazardly on the rebound at random indiscriminately,1328220
手心を加える,てごころをくわえる,exp v1,v1,3,to take into consideration to use one's discretion,1895670
手数をかける,てすうをかける,exp v1,v1,2,to be a burden to make trouble for someone,2104120
手柄を立てる,てがらをたてる,exp v1,v1,2,to do a meritorious deed,1895470
手段を尽くす,しゅだんをつくす,exp v5s,v5,3,to try everything to leave no stone unturned,1882130
手段を講じる,しゅだんをこうじる,exp v1,v1,2,to take steps (measures),1882120
手段を選ばずに,しゅだんをえらばずに,exp,,1,"by any means, fair or foul",2424510
手段を選ばない,しゅだんをえらばない,exp,,2,to do whatever it takes to use every trick in the book to use any means to stop at nothing,2830669
手水を使う,ちょうずをつかう,exp v5u,v5,1,to go to the toilet,2769150
手玉に取る,てだまにとる,exp v5r,v5,2,to lead someone around by the nose,2089280
手生け,ていけ,exp,,5,doing one's own flower arranging,1698550
手短に言うと,てみじかにいうと,exp,,2,in brief to put it succinctly,2584160
手短に言えば,てみじかにいえば,exp,,3,briefly in short in a nutshell in summary to put it briefly,2584150
手紙を出す,てがみをだす,exp v5s,v5,3,to mail a letter,1895460
手紙を宛てる,てがみをあてる,exp v1,v1,1,to address (direct) a letter to a person,1895440
手紙を添える,てがみをそえる,exp v1,v1,1,to attach a letter to include a letter,1895450
手続きを経る,てつづきをへる,exp v1,v1,2,to go through formalities,1895770
手綱を緩める,たづなをゆるめる,exp v1,v1,2,to slack the reins,1891230
手練の早技,しゅれんのはやわざ,exp,,1,dexterous feat speed and precision of a trained hand,2136950
手術を受ける,しゅじゅつをうける,exp v1,v1,4,to undergo surgery to have an operation,2573890
手袋を投げる,てぶくろをなげる,exp v1,v1,2,to throw down the gauntlet,2268740
手許現金,てもとげんきん,exp,,1,cash on hand,2420930
手足を伸ばす,てあしをのばす,exp v5s,v5,1,to stretch out,2403000
手鍋提げても,てなべさげても,exp,,3,even if it means living in dire poverty by all means,1699530
手間が省ける,てまがはぶける,exp v1,v1,2,to save trouble to save effort to save hassle to save bother to save time,2685970
手間を取る,てまをとる,exp v5r,v5,2,to be detained to take time,1895930
手間を掛ける,てまをかける,exp v1,v1,3,to take up someone's time to make work for someone,2104130
手順を踏む,てじゅんをふむ,exp v5m,v5,1,to go through the proper procedures to follow the required steps,2773770
才子多病,さいしたびょう,exp yoji,,2,Talented people tend to be of delicate constitution Men of genius tend to be of delicate health Whom the gods love die young,2045520
才子才に溺れる,さいしさいにおぼれる,exp id,,1,A man of talent is ruined by his own talent,2417520
才能を伸ばす,さいのうをのばす,exp v5s,v5,2,to develop one's ability,1878370
打ち付け言,うちつけごと,exp n arch,,-99,saying whatever comes into one's mind,2708240
打って一丸となる,うっていちがんとなる,exp v5r,v5,2,to be united to act as a single body,2121170
打つ手がない,うつてがない,exp adj-i,adj-i,1,no way to do nothing can be done,1408830
打てば響く,うてばひびく,exp v5k,v5,4,to be responsive to show immediate results,2735790
批難の目を向ける,ひなんのめをむける,exp v1,v1,1,to regard someone with odium to look at someone with reproach,1904580
批難を浴びせる,ひなんをあびせる,exp v1,v1,1,to heap abuse upon (a person) to criticize strongly to blast (someone),1904590
承知の上で,しょうちのうえで,exp,,3,intentionally on purpose deliberately taking something into account,2534220
承知の助,しょうちのすけ,exp col yoji,,5,OK Sure Yessir! Okeydokey! Understood,1349510
技を磨く,わざをみがく,exp v5k,v5,2,to improve one's skill,1917470
技神に入る,ぎしんにいる,exp v5r,v5,1,to be divinely skilled,2433070
技術的に困難,ぎじゅつてきにこんなん,exp adj-na,,2,technically difficult,2592610
抑え切れず,おさえきれず,exp,,1,uncontainable irrepressibile uncontrollable,2522210
抑揚のない,よくようのない,exp adj-i,adj-i,4,monotonous,2555830
投資の限界効率,とうしのげんかいこうりつ,exp n,,1,marginal efficiency of investment,2163890
折から,おりから,exp n-t,,606,just then at that time right then at that moment,1385790
折も折,おりもおり,exp adv,,3,at that very moment coincidentally,1385800
折曲厳禁,おりまげげんきん,exp,,1,do not fold do not bend,2251540
折紙を付ける,おりがみをつける,exp v1,v1,1,to guarantee (someone's ability or the quality of their work) to vouch for to endorse,2102650
抜からぬ顔,ぬからぬかお,exp n obsc,,3,shrewd face knowing look,1680130
抜きにして,ぬきにして,exp,,1,leaving out cutting out dispensing with,2027740
抜き差しならない,ぬきさしならない,exp adj-i,adj-i,1,be inextricably involved be in a sticky situation,2643920
抜き差しならぬ,ぬきさしならぬ,exp adj-f,,2,sticky (situation) finding oneself trapped,1680050
抜き足で,ぬきあしで,exp,,4,stealthily,1679990
抜き足差し足,ぬきあしさしあし,exp yoji,,3,stealthy footsteps walking on tiptoe,1680000
抜き足差し足忍び足,ぬきあしさしあししのびあし,exp,,1,stealthy footsteps walking on tiptoe,2398040
抜くべからざる,ぬくべからざる,exp adj-pn,,1,"deep-rooted (suspicion, etc.)",2813240
抜け目がない,ぬけめがない,exp adj-i,adj-i,3,shrewd astute cunning alert,2246530
抜け目のない,ぬけめのない,exp adj-i,adj-i,3,shrewd astute cunning alert,2246520
抵抗を試みる,ていこうをこころみる,exp v1,v1,2,to offer (put up) resistance,1895260
押しの強い,おしのつよい,exp adj-i,adj-i,2,aggressive pushy in-your-face,2829650
押しも押されもせぬ,おしもおされもせぬ,exp adj-f,,1,of established reputation,1862420
担任の先生,たんにんのせんせい,exp n,,3,class teacher homeroom teacher form teacher,2189500
拍手を打つ,かしわでをうつ,exp v5t,v5,2,to clap one's hands in prayer,1209300
拍手を送る,はくしゅをおくる,exp v5r,v5,1,to give a round of applause to applaud,2782880
拍車がかかる,はくしゃがかかる,exp v5r,v5,2,to expedite to encourage to spur (on),2630160
拍車を掛ける,はくしゃをかける,exp v1,v1,3,to spur (on) to expedite to encourage,1474810
拓け胡麻,ひらけごま,exp,,1,Open Sesame!,2077360
拘らず,かかわらず,exp uk,,5,in spite of regardless of,1589860
招かれざる客,まねかれざるきゃく,exp n,,2,uninvited guest,2403900
招待にあずかる,しょうたいにあずかる,exp v5r obsc,v5,2,to receive an invitation,1882770
拠点とする,きょてんとする,exp vs-i,vs,1,to be based in (a place),1232450
拠点に置く,きょてんにおく,exp v5k,v5,1,to be based in (a place),1232460
拳を打つ,けんをうつ,exp v5t,v5,1,"to play a hand game (e.g. rock, paper, scissors)",2760470
拳を握る,こぶしをにぎる,exp v5r,v5,2,to make a fist to clench one's fist,2764080
持たざる,もたざる,exp adj-f,,3,have-not,2511990
持ちがいい,もちがいい,exp adj-ix,,2,wear well keep long last long,2827378
持ちがよい,もちがよい,exp adj-i,adj-i,1,wear well keep long last long,1315480
持ちつ持たれつ,もちつもたれつ,exp n,,2,give-and-take,1315490
持ちのいい,もちのいい,exp adj-ix,,1,long lasting,2827379
持ちのよい,もちのよい,exp adj-i,adj-i,1,long lasting,2238050
持ちも提げもならない,もちもさげもならない,exp adj-i obsc,adj-i,1,no way at all to deal with,2179430
持ちも提げもならぬ,もちもさげもならぬ,exp obsc,,1,having no way to deal with something,2179530
持っていく,もっていく,exp v5k-s,v5,608,to take to carry (something) away to bear,1315700
持ってくる,もってくる,exp vk,vk,609,to bring to take (something) along to fetch to get,1315710
持ってけ,もってけ,exp sl vulg,,2,Take it! Take that!,2103530
持って回る,もってまわる,exp v5r,v5,4,to carry around,1849200
持って来い,もってこい,exp adj-na adj-no uk,,5,just right ideal perfectly suitable,1769980
持って生まれた,もってうまれた,exp adj-f,,3,natural (ability),1769940
持てる者と持たざる者,もてるものともたざるもの,exp,,3,haves and have-nots,2512000
持続可能な開発,じぞくかのうなかいはつ,exp n,,3,sustainable development,2549300
指の腹,ゆびのはら,exp n,,2,ball of a finger finger cushion pulp of the finger pad of the finger,2803940
指をくわえる,ゆびをくわえる,exp v1,v1,3,to look on enviously while doing nothing to look on with a finger in one's mouth,2669760
指を折る,ゆびをおる,exp v5r,v5,4,to count on one's fingers,2776480
指を詰める,ゆびをつめる,exp v1,v1,4,to cut off a finger (as an act of apology),1914180
指を離す,ゆびをはなす,exp v5s,v5,1,to let go,2777610
指を鳴らす,ゆびをならす,exp v5s,v5,4,to snap one's fingers,2692910
指切拳万、嘘ついたら針千本呑ます,ゆびきりげんまん、うそついたらはりせんぼんのます,exp id,,1,"Finger cut-off, ten thousand fist-punches, whoever lies has to swallow a thousand needles words said when making a pinky swear",2833702
指揮を執る,しきをとる,exp v5r,v5,2,to take command to give direction,2251750
指示を出す,しじをだす,exp v5s,v5,2,to give directions to issue instructions,2553710
挑戦いかに,ちょうせんいかに,exp obsc,,1,How dare you!,2104730
挙措を失う,きょそをうしなう,exp v5u,v5,1,to lose one's composure to lose one's temper,2828165
挨拶,あいさつ,exp,,738,a fine thing to say (used as part of a sarcastic response to a rude remark),1151120
挨拶は抜きで,あいさつはぬきで,exp,,2,without compliments (greetings),1855940
挨拶は時の氏神,あいさつはときのうじがみ,exp proverb,,1,those arguing should be thankful for a mediator's intervention and follow the mediator's advice,2832652
挨拶を交わす,あいさつをかわす,exp v5s,v5,4,to exchange greetings,2229050
振りをする,ふりをする,exp vs-i uk,vs,3,to pretend,2272580
振るった,ふるった,exp,,4,different eccentric original striking extraordinary,1625000
捉えどころのない,とらえどころのない,exp adj-i uk,adj-i,3,subtle elusive slippery,1855660
捕らぬ狸の皮算用,とらぬたぬきのかわざんよう,exp proverb,,3,don't count your chickens before they're hatched counting raccoon dog skins before they have been caught,1514120
捗が行く,はかがゆく,exp v5k,v5,1,to make progress to move right ahead (with the work) to advance,2817370
捨てたものではない,すてたものではない,exp,,2,not without its worth not to be undervalued,2214830
捨てる神在れば拾う神在り,すてるかみあればひろうかみあり,exp proverb,,1,"When one door is shut, another is open The world is as kind as it is cruel",2417780
捩じり鉢巻きで,ねじりはちまきで,exp adv,,2,as hard as one can with one's whole heart,2126220
捩って,もじって,exp uk,,1,parodying,2406970
据え膳食わぬは男の恥,すえぜんくわぬはおとこのはじ,exp id,,1,rejecting the advances of women is a man's shame shameful is he who spurns a woman's invitation not eating the meal set before him is a man's shame,2418470
掃いて捨てるほど,はいてすてるほど,exp,,2,a dime a dozen two a penny,2126230
掃き溜めに鶴,はきだめにつる,exp,,3,a jewel in a dunghill,1399750
授業を受ける,じゅぎょうをうける,exp v1,v1,2,to take a class,1330300
掌の玉,たなごころのたま,exp n,,1,apple of one's eye,2827977
掌を指す,たなごころをさす,exp v5s id,v5,2,to be obvious to be obviously correct to point to one's palm,1891640
掛かり負け,かかりまけ,exp,,3,expenses being higher than profits,2593040
掛け替えのない,かけがえのない,exp adj-f uk,,4,irreplaceable,1207650
探しに,さがしに,exp,,1,in search of in order to look for,2083640
探りを入れる,さぐりをいれる,exp v1,v1,2,to probe to search to sound out to investigate,2402150
控えの間,ひかえのま,exp n,,3,anteroom antechamber,1903420
控えを取る,ひかえをとる,exp v5r,v5,1,to take a copy of,1903450
推して,おして,exp,,3,by conjecture (deduction),1862360
推して知るべし,おしてしるべし,exp,,3,can be easily guessed,2066410
措いて,おいて,exp uk,,4,except no other,1643550
措置を講じる,そちをこうじる,exp v1,v1,2,to take measures to take steps to take action to make a move,2672120
掲示を出す,けいじをだす,exp v5s,v5,3,to post a notice to put up a notice,2611800
