0,1,2,3,4,5,6
竜虎の争い,りゅうこのあらそい,exp n,,1,well-matched contest fight between a dragon and a tiger,1915850
竜虎相搏つ,りゅうこあいうつ,exp id,,1,Diamonds cut diamonds,2420060
章を改める,しょうをあらためる,exp v1,v1,1,to begin a new chapter,1883100
端から,はしから,exp,,3,every last one one and all from A to Z,2464070
端から,はなから,exp uk,,3,from the start from the beginning from the outset,2119610
端から端まで,はしからはしまで,exp,,2,from one end to another thoroughly completely utterly,2464080
端を発する,たんをはっする,exp vs-s,vs,2,to originate with to start with to stem from,2211500
端を開く,たんをひらく,exp v5k,v5,2,to provide impetus,2764530
端的に言う,たんてきにいう,exp v5u,v5,2,to come to the point to get straight to the point to speak frankly to speak plainly to talk straight,2657600
竹に雀,たけにすずめ,exp id,,3,going well together good combination,2714150
竹の子族,たけのこぞく,exp n,,1,"people who partied flamboyantly in Harajuku, etc. in the 70s and 80s",2828351
竹を割ったよう,たけをわったよう,exp adj-na,,5,clear-cut and straightforward,2592530
竹馬に乗る,たけうまにのる,exp v5r,v5,2,to walk on stilts,2831674
竹馬の友,ちくばのとも,exp n,,2,childhood friend old playmate,1422380
笑いの壺,わらいのつぼ,exp n,,1,sense of humour (humor) funny bone,2756220
笑いを取る,わらいをとる,exp v5r,v5,2,to get a laugh,2661710
笑う門には福来る,わらうかどにはふくきたる,exp proverb,,1,laugh and grow fat good fortune and happiness will come to the home of those who smile,2152700
笑みをたたえる,えみをたたえる,exp v1,v1,2,to be all smiles,2255850
笑壺の会,えつぼのかい,exp n,,1,gathering that's fun for everyone present,2755430
笑門,しょうもん,exp abbr,,1,(good fortune and happiness will come to) the home of those who smile,2826643
笑門来福,しょうもんらいふく,exp yoji,,1,good fortune and happiness will come to the home of those who smile,2826642
笑門福来,しょうもんふくらい,exp yoji,,1,good fortune and happiness will come to the home of those who smile,2826693
笛吹けども踊らず,ふえふけどもおどらず,exp id,,2,We have piped unto you and ye have not danced,2419070
笠に着る,かさにきる,exp v1,v1,2,to wear the mantle of (borrowed) authority and misuse it,2122080
笠の台が飛ぶ,かさのだいがとぶ,exp v5b,v5,2,to be fired to be decapitated,1865150
符号無し,ふごうなし,exp,,1,unsigned,1497740
第一次オイルショック,だいいちじオイルショック,exp n,,2,oil crisis of 1973-74 first oil shock,2819110
第一種の過誤,だいいっしゅのかご,exp n math,,1,type I error,2716420
第三のビール,だいさんのビール,exp n,,3,"cheap, malt-free beer-like alcoholic beverage",2098740
第三者のためにする契約,だいさんしゃのためにするけいやく,exp n law,,2,third party beneficiary contract,2764600
第三者異議の訴え,だいさんしゃいぎのうったえ,exp n law,,1,third-party action against execution,2764620
第二次オイルショック,だいにじオイルショック,exp n,,2,second oil crisis (1979),2819120
第二種の過誤,だいにしゅのかご,exp n math,,1,type II error,2716430
第四の壁,だいしのかべ,exp n,,2,fourth wall (in fiction),2440430
筆が立つ,ふでがたつ,exp v5t,v5,2,good writer wielding a facile pen,1624580
筆を執る,ふでをとる,exp v5r,v5,3,to pen to write to draw,1906270
筆を折る,ふでをおる,exp v5r,v5,2,to break off writing,1906260
筆を揮う,ふでをふるう,exp v5u,v5,1,to drive a quill (pen) to wield the writing brush,1487780
筆を置く,ふでをおく,exp v5k,v5,3,to stop writing to put down one's pen to close (a letter),1906250
筆舌に尽くしがたい,ひつぜつにつくしがたい,exp adj-i,adj-i,2,beyond description,1903980
筈の無い,はずのない,exp adj-i uk,adj-i,1,cannot (do) it is impossible that... it is (highly) unlikely that...,2831138
等を分ける,とうをわける,exp v1,v1,2,to grade to classify,1897230
等閑に付す,とうかんにふす,exp v5s,v5,2,to neglect to overlook,2801170
筋が立つ,すじがたつ,exp v5t,v5,1,to make sense to be consistent,2153280
筋が通る,すじがとおる,exp v5r,v5,3,to make sense to be consistent to be logical to stand to reason to be coherent,2153270
筋の通った,すじのとおった,adj-f exp,,3,rational logical coherent,1886990
筋の通らない,すじのとおらない,exp adj-i,adj-i,2,illogical inconsistent,2200730
筋を通す,すじをとおす,exp v5s,v5,2,to proceed in a logical manner to go through the proper channels,2200710
筋を違える,すじをちがえる,exp v1,v1,2,to pull a muscle to strain a muscle,2183530
筋立て,すじだて,exp,,3,plot (of a story),1728610
答えにくい質問,こたえにくいしつもん,exp n,,2,awkward (difficult) question,1876770
答えを出す,こたえをだす,exp v5s,v5,1,to give an answer to find an answer to a question to work out a solution,2654960
答えを渋る,こたえをしぶる,exp v5r,v5,2,to be reluctant to answer to hesitate to answer,1876780
策を施す,さくをほどこす,exp v5s,v5,3,to take measures,1878740
策を講ずる,さくをこうずる,exp vz,,1,to take (adopt) measures,1878730
策士策に溺れる,さくしさくにおぼれる,exp proverb,,1,craft brings nothing home the crafty schemer drowns in his own scheme,2417550
箍が外れる,たががはずれる,exp v1 vi,v1,1,to become unrestrained and go to excess to lose all restraint to lose one's tension and become relaxed to let go to become disorderly to be scattered to lose one's self-control,2699230
箍を嵌める,たがをはめる,exp v1,v1,2,to hoop to put a hoop on to bind a barrel with hoops,1922580
箍を締める,たがをしめる,exp v1,v1,3,to pull oneself together to get one's act together to brace oneself,1922570
箔が付く,はくがつく,exp v5k,v5,3,to increase in value to gain prestige,2020190
箔を付ける,はくをつける,exp v1,v1,2,to give something weight to give something dignity,2601540
算を置く,さんをおく,exp v5k,v5,3,to calculate to divine,1879610
算盤を弾く,そろばんをはじく,exp v5k,v5,3,to count on the abacus,2832275
箝口令をしく,かんこうれいをしく,exp v5k,v5,3,to impose a gag order to hush up to order someone not to mention something,2135290
管の穴から天を覗く,くだのあなからてんをのぞく,exp id,,1,Have a narrow view of things,2416850
管を以て天を窺う,くだをもっててんをうかがう,exp,,1,to make a personal judgment on a problem with little insight to look at the sky through a tube (Zhuangzi),2832600
管を巻く,くだをまく,exp v5k,v5,2,to grumble over one's wine cups,1872080
箪笥の肥やし,たんすのこやし,exp,,2,unused things (esp. clothing) objects bought but never used,2458260
箸が転んでも可笑しい年頃,はしがころんでもおかしいとしごろ,exp n,,1,age at which even the slightest things seem funny (esp. said of a girl in the late teens),2755130
箸が進む,はしがすすむ,exp adj-f,,1,appetizing,2770500
箸にも棒にも掛からない,はしにもぼうにもかからない,exp,,2,hopeless unmanageable incorrigible,2131080
箸を取る,はしをとる,exp v5r,v5,1,to take up one's chopsticks (to begin a meal) to start to eat to eat,2770510
節を付ける,ふしをつける,exp v1,v1,1,"to sing (chant, speak) with a melody or rhythm to set to music (verse, lyrics, etc.)",2759940
節を曲げない,せつをまげない,exp adj-i,adj-i,2,remaining firm sticking by one's principles not budging an inch,1888520
節先生,たかしせんせい,exp,,1,successive teacher successive master,2405890
節操が無い,せっそうがない,exp adj-i,adj-i,1,inconstant unprincipled,2833077
節目節目,ふしめふしめ,exp yoji,,1,each juncture each turning point,2087370
範を垂れる,はんをたれる,exp v1,v1,2,to give an example,1903100
範囲を狭める,はんいをせばめる,exp v1,v1,1,to narrow down the range,1902320
篠を突く,しのをつく,exp v5k,v5,2,to pour (of rain) to pound down,2570020
篠突く雨,しのつくあめ,exp n,,3,intense rain,2569310
簡にして要を得る,かんにしてようをえる,exp v1,v1,1,to be brief and to the point to be succinct,2638610
簡単に言うと,かんたんにいうと,exp,,2,simply put,1214340
簡単に言えば,かんたんにいえば,exp,,2,simply put putting it simply in short,1214350
籍に入れる,せきにいれる,exp v1,v1,1,to have a name entered in the family register,2716600
籍を入れる,せきをいれる,exp v1,v1,2,to have a name entered in the family register,1888300
籍を置く,せきをおく,exp v5k,v5,2,"to be enrolled (in a college, course of study, etc.) to be a member (of an organization)",1383110
籠で水を汲む,かごでみずをくむ,exp v5m obsc,v5,1,"like trying to scoop water with a basket (i.e. impossible, a waste of time & energy)",2179330
籠の鳥,かごのとり,exp,,4,caged bird,2179320
籠もった声,こもったこえ,exp n,,1,thick voice,1877450
米の祝い,よねのいわい,exp n,,1,longevity celebration for one's 88th year,2232140
米の飯,こめのめし,exp n,,1,something one never grows tired of,2691660
米塩の資,べいえんのし,exp n,,1,living expenses,2808580
米百俵,こめひゃっぴょう,exp id,,2,kome hyappyo (ideal of) enduring pain today for the sake of a better tomorrow hundred sacks of rice,2829151
粉々になる,こなごなになる,exp v5r,v5,4,to break into fragments to go to pieces,1877200
粉々に砕く,こなごなにくだく,exp v5k,v5,2,to smash to pieces,1593370
粉屋の泥棒,こなやのどろぼう,exp n arch derog id,,-99,heavily made-up woman flour-shop burglar,2716740
粋が身を食う,すいがみをくう,exp id,,1,Playing the dandy ruins a man,2418460
粗末にする,そまつにする,exp vs-i,vs,4,to waste to treat shabbily to treat frivolously to handle roughly to treat without respect,2146940
粗末に扱う,そまつにあつかう,exp v5u,v5,1,to handle (a thing) roughly,1890130
粗熱を取る,あらねつをとる,exp v5r,v5,2,"to let something (e.g. frypan, pot) cool down",2798040
粗診粗療,そしんそりょう,exp n yoji,,1,poor medical consultation leading to poor treatment,2827441
粘土層,ねんどそう,exp,,3,layer of clay clay stratum,2533630
粛として,しゅくとして,exp,,3,quietly softly solemnly,1337690
精が出る,せいがでる,exp v1,v1,1,to work hard to make an effort,2707780
精が尽きる,せいがつきる,exp v1,v1,2,to be exhausted one's energy is gone,1887460
精も根も尽き果てる,せいもこんもつきはてる,exp v1,v1,1,to use up all of one's energy and willpower to be exhausted (and have no will to go on),2125340
精を出して働く,せいをだしてはたらく,exp v5k,v5,1,to toil to labor industriously,2668460
精を出す,せいをだす,exp v5s,v5,3,to work hard to work diligently,1888080
精を漏らす,せいをもらす,exp v5s,v5,1,to have an involuntary emission of semen,1888090
精根を込める,せいこんをこめる,exp v1,v1,1,to pour one's heart and soul into,2125350
精神一到何事か成らざらん,せいしんいっとうなにごとかならざらん,exp,,3,"Where there is a will, there is a way",2081190
精魂を傾ける,せいこんをかたむける,exp v1,v1,2,to put one's heart and soul into something,2183620
糞の役にも立たぬ,くそのやくにもたたぬ,exp derog,,1,completely worthless utterly useless,2706920
糞も味噌も一緒,くそもみそもいっしょ,exp id,,2,not distinguishing between what's good and bad not knowing chalk from cheese mixing good and bad together shit and miso are the same,2419680
糞を食らえ,くそをくらえ,exp vulg,,1,eat shit! fuck off! fuck you!,2706940
糞味噌に言う,くそみそにいう,exp v5u,v5,3,to verbally attack (violently) to run down to criticize severely to criticise severely,1504920
糟を食う,かすをくう,exp v5u id,v5,1,to be scolded (mainly used theatrically),2702850
糟糠の妻,そうこうのつま,exp,,4,one's devoted wife wife who has followed one through hard times wife married in poverty,2569580
糠に釘,ぬかにくぎ,exp,,3,having no effect waste of effort,2727590
糸に紡ぐ,いとにつむぐ,exp v5g,v5,2,to spin into yarn,1912210
糸を垂れる,いとをたれる,exp v1,v1,1,to fish to have a line in the water,2402900
糸を引く,いとをひく,exp v5k,v5,3,to pull (the puppet) strings to direct things from behind the scenes,2183560
糸を張る,いとをはる,exp v5r,v5,1,to stretch a string,1859110
糸を組む,いとをくむ,exp v5m,v5,1,to braid string,1859100
糸を通す,いとをとおす,exp v5s,v5,1,"to thread (e.g. a needle, beads, etc.)",2136580
糸口を開く,いとぐちをひらく,exp v5k,v5,2,to find a clue to make a beginning,1859060
約を交わす,やくをかわす,exp v5s obsc,v5,1,to exchange promises,1913050
約束に背く,やくそくにそむく,exp v5k,v5,2,to break one's promise,1912940
約束の通り,やくそくのとおり,exp n adv,,2,as promised true to one's promise,1912950
約束やぶる,やくそくやぶる,exp v5r,v5,1,to break a promise to go back on one's word to renege,2100700
約束を守る,やくそくをまもる,exp v5r,v5,2,to keep a promise to keep one's word,2100680
約束を破る,やくそくをやぶる,exp v5r,v5,2,to break a promise to go back on one's word to renege,2100690
紆余曲折を経て,うよきょくせつをへて,exp,,2,after many twists and turns after much trouble,2402550
納得がいく,なっとくがいく,exp v5k-s,v5,2,"to understand and accept as valid (of a thought, action, etc.) to be satisfied with",2203620
紐を結ぶ,ひもをむすぶ,exp v5b,v5,1,to tie a string,1904790
紗のよう,しゃのよう,exp adj-na,,2,gauzy,1616150
紙を破る,かみをやぶる,exp v5r,v5,1,to tear (up) paper,1866760
紛れもない,まぎれもない,exp adj-i,adj-i,603,certain unmistaken evident obvious beyond doubt,2088270
素知らぬ振り,そしらぬふり,exp,,2,pretending not to know pretending not to recognize someone (recognise) feigning ignorance playing innocent,2104080
素知らぬ顔,そしらぬかお,exp n,,4,pretending not to recognize (recognise) feigned ignorance,1749480
累を及ぼす,るいをおよぼす,exp v5s,v5,2,to cause trouble (for someone) to have an unfavourable effect on (unfavorable),1891710
累卵の危うき,るいらんのあやうき,exp,,2,imminent danger threatened ruin,2827873
細い字,ほそいじ,exp n,,1,slender character,1908460
細い糸,ほそいいと,exp n,,2,fine thread,1908450
細かいお金,こまかいおかね,exp n,,4,small change,1919580
細かいこと,こまかいこと,exp,,605,trifles minor details,2201370
細かい指示,こまかいしじ,exp n,,1,detailed instructions,1877320
細かい金,こまかいかね,exp n,,2,small change,1877310
細大漏らさず,さいだいもらさず,exp,,1,in minute detail,2125370
細細した,こまごました,exp adj-f,,2,sundry various assorted,1877340
紺屋の白袴,こうやのしろばかま,exp,,1,the shoemaker's children go barefoot the dyer wears white specialists often fail to apply their skills to themselves,2093280
終わりまで,おわりまで,exp,,2,to the end,2199930
終わりを告げる,おわりをつげる,exp v1,v1,3,to mark the end to spell the end,2403010
終わりんこ,おわりんこ,exp sl,,1,finished done with,2826788
終わり良ければすべて良し,おわりよければすべてよし,exp,,3,all is well that ends well it will all come good in the end,2417840
終戦直後,しゅうせんちょくご,exp,,2,early post war period immediately after the war,2545940
終日禁煙,しゅうじつきんえん,exp,,1,no smoking at any time,2646590
終止符を打つ,しゅうしふをうつ,exp v5t,v5,2,put an end (to) close the books (on),2146910
終油の秘跡,しゅうゆのひせき,exp n obs,,1,extreme unction,2798490
組になる,くみになる,exp v5r,v5,3,to join forces with to cooperate with,1633600
組を作る,くみをつくる,exp v5r,v5,2,to make up a party,1872540
組んず解れつ,くんずほぐれつ,exp adj-no uk,,2,locked in a grapple,2169430
組んづ解れつ,くんづほぐれつ,exp adj-no uk,,1,locked in a grapple,2659090
経たぬ内に,たたぬうちに,exp,,1,"before ... days (months, etc.)",2016570
経て,へて,exp,,2,through by way of after via,2648360
経てば,たてば,exp,,1,after in (an amount of time),2825834
経を念じる,きょうをねんじる,exp v1,v1,2,to chant a sutra,1870370
経験が浅い,けいけんがあさい,exp adj-i,adj-i,3,having little experience,1251280
経験を問わず,けいけんをとわず,exp,,2,no experience necessary,1873150
経験を得る,けいけんをえる,exp v1,v1,1,to gain experience,2207140
経験を生かす,けいけんをいかす,exp v5s,v5,2,to draw on one's experience to make good use of one's experience to turn one's experience to good account,2831386
経験を積む,けいけんをつむ,exp v5m,v5,2,to gain experience to accumulate experiences,2767360
結び目を解く,むすびめをほどく,exp v5k,v5,1,to undo a knot,1911360
結ぶ便,むすぶびん,exp n,,1,connecting flight connecting service,2759490
結婚を許す,けっこんをゆるす,exp v5s,v5,1,to give permission to marry,1873510
結局のところ,けっきょくのところ,exp adv,,3,in the end at the end of the day,2248660
結果オーライ,けっかオーライ,exp,,3,(turned out) all right in the end,2224750
結社の自由,けっしゃのじゆう,exp n,,3,freedom of association,1254850
結論を下す,けつろんをくだす,exp v5s,v5,3,to draw a conclusion,1873630
給油口のふた,きゅうゆこうのふた,exp n,,1,petrol cap,2260320
絵になる,えになる,exp adj-f,,1,picture-perfect picturesque,2225110
絵に描いたよう,えにかいたよう,exp,,1,the very picture of ...,2100540
絵に描いた餅,えにかいたもち,exp,,4,pie in the sky castle in the air,1202280
絵の具を溶く,えのぐをとく,exp v5k,v5,3,to dissolve colors to dissolve colours,1861440
絵を描く,えをかく,exp v5k,v5,604,to paint (draw) a picture,2249810
絶対安全,ぜったいあんぜん,exp adj-na,,1,fail-safe foolproof totally safe,2811810
絹を裂くよう,きぬをさくよう,exp adj-na,,1,"shrill piercing (scream, etc.)",2725260
継続は力なり,けいぞくはちからなり,exp,,2,persevering through something difficult makes one stronger whatever doesn't kill us only makes us stronger slow but steady wins the race,2109530
続いて,つづいて,exp,,4,after ... following ... in the wake of ...,2542450
維新の党,いしんのとう,exp n,,1,Japan Innovation Party,2827010
綯い交ぜにする,ないまぜにする,exp vs-i,vs,4,to blend (e.g. truth and lies) to mix together (e.g. kanji and kana),1009370
綱を張る,つなをはる,exp v5r sumo,v5,3,to become a yokozuna to be a yokozuna,1894840
網の目をくぐる,あみのめをくぐる,exp v5r,v5,2,to slip through the dragnet,2219300
網を打つ,あみをうつ,exp v5t,v5,3,to cast a net to throw a net,2566540
網呑舟の魚を漏らす,あみどんしゅうのうおをもらす,exp id obsc,,2,(of a legal system) so lax that even the greatest criminal can escape,2141210
綴じて,とじて,exp,,2,in bound form,1897590
綺麗な薔薇には刺がある,きれいなばらにはとげがある,exp proverb,,1,there is no rose without a thorn every rose has its thorn,2420170
綾を成して,あやをなして,exp,,1,in beautiful patterns,1857190
緋の袴,ひのはかま,exp n,,1,red hakama (worn by miko or noblewomen at court),2826112
総領の甚六,そうりょうのじんろく,exp id,,1,"First born, least clever",2418760
緑の革命,みどりのかくめい,exp n,,1,green revolution,2690740
緒につく,しょにつく,exp v5k,v5,3,to be started to get underway,1882300
線が太い,せんがふとい,exp adj-i,adj-i,1,impressive tough,2648140
線が細い,せんがほそい,exp adj-i,adj-i,1,sensitive fragile feeble indecisive,2648150
線の太い,せんのふとい,exp adj-i,adj-i,1,strong-nerved decisive,1889030
線を引く,せんをひく,exp v5k,v5,3,to draw a line,1889140
締まった体格,しまったたいかく,exp n,,102,firm build well-knit frame,1881430
締まらない,しまらない,exp adj-i uk,adj-i,5,loose slovenly sloppy disorganized,2509680
締まりがない,しまりがない,exp adj-i uk,adj-i,3,not at all tense relaxed calm,2173920
締まりのない,しまりのない,exp adj-i,adj-i,6,slack loose lax slovenly sloppy,1881450
締めくくりをつける,しめくくりをつける,exp v1,v1,3,to bring to a finish to complete,1436590
編みの籠,あみのかご,exp n,,1,wicker basket wickerwork basket,2790900
緩やかに進む,ゆるやかにすすむ,exp v5m,v5,1,to proceed slowly,1914270
練習を積む,れんしゅうをつむ,exp v5m,v5,2,to practice to practise to train to drill to become practiced to become practised,2771070
縁がある,えんがある,exp,,1,to be fated to be linked by fate,2425440
縁がない,えんがない,exp adj-i,adj-i,2,have no relation to have no luck with not be fated to,1861530
縁が遠い,えんがとおい,exp adj-i,adj-i,1,distantly related,1861520
縁につながる,えんにつながる,exp v5r,v5,3,to be related to someone by blood,1973260
縁のない,えんのない,exp adj-i,adj-i,2,unrelated unconnected,2238350
縁の遠い,えんのとおい,exp adj-i,adj-i,1,distantly related,2238460
縁は異なもの,えんはいなもの,exp,,4,inscrutable are the ways people are brought together there is no telling how people are brought together,2113740
縁は異なもの味なもの,えんはいなものあじなもの,exp,,4,inscrutable and interesting are the ways people are brought together,2113730
縁もゆかりもない,えんもゆかりもない,exp,,3,having no relation with whatsoever having nothing to do with alien,2571150
縁を切る,えんをきる,exp v5r,v5,3,to get a divorce to sever connections,1861690
縁を結ぶ,えんをむすぶ,exp v5b,v5,3,to get married to contract a marriage,2425450
縁談を調える,えんだんをととのえる,exp v1,v1,3,to arrange a marriage,1861590
縁起がいい,えんぎがいい,exp adj-ix,,1,of good omen augur well (for) boding well for good fortune,2822310
縁起が悪い,えんぎがわるい,exp,,4,of bad omen ill augur boding evil bad fortune,2514850
縁起が良い,えんぎがよい,exp adj-i,adj-i,3,of good omen augur well (for) boding well for good fortune,2514860
縁起でもない,えんぎでもない,exp,,4,"ill omened (as in ""Don't say such an ill omened thing!"") unlucky",2098070
縁起を担ぐ,えんぎをかつぐ,exp v5g,v5,3,to be superstitious to believe in omens,2102390
縛に就く,ばくにつく,exp v5k,v5,1,to be arrested to be put in bonds,1621830
縦の物を横にもしない,たてのものをよこにもしない,exp,,1,too lazy to do anything,2120890
縫い代を割る,ぬいしろをわる,exp v5r,v5,1,to stop an inside seam rolling about to press open a seam (and open the left and right sides out),2107890
織り込み済み,おりこみずみ,exp,,1,taking something into consideration making allowances discounting,2446880
繭をかける,まゆをかける,exp v1,v1,3,to spin a cocoon,1525700
纏まった,まとまった,exp uk,,3,large heavy massed quite a lot large amount sizable (e.g. sum),2428080
罠に掛かる,わなにかかる,exp v5r,v5,1,"to fall for (a trick, ambush, etc.)",1854960
罪が無い,つみがない,exp adj-i,adj-i,1,innocent not guilty harmless,2744830
罪に問う,つみにとう,exp v5u-s,v5,2,to accuse somebody to charge someone,2826817
罪に陥る,つみにおちいる,exp v5r,v5,2,to slide into sin,1894940
罪のない嘘,つみのないうそ,exp,,3,white lie harmless lie fib,2623550
罪の報い,つみのむくい,exp,,1,retribution for one's crime punishment for one's crime,2522400
罪の報いを受ける,つみのむくいをうける,exp v1,v1,1,to pay for one's transgression to receive punishment for one's crime,2522410
罪の無い,つみのない,exp adj-i,adj-i,4,guiltless innocent,1894950
罪を憎んで人を憎まず,つみをにくんでひとをにくまず,exp,,1,"condemn the offense, but not the offender",2756050
罪を犯す,つみをおかす,exp v5s,v5,2,to commit a crime to commit a sin,1894960
罪を着せる,つみをきせる,exp v1,v1,3,to pin a crime on,1894970
罪を着る,つみをきる,exp v1,v1,2,to take (another's guilt) on oneself to be accused of,1894980
罪人を流す,ざいにんをながす,exp v5s,v5,1,to exile a criminal,1879690
罫線を引く,けいせんをひく,exp v5k,v5,3,to rule (line),1251930
置いてきぼり,おいてきぼり,exp,,3,leaving somebody behind,2036670
置いてきぼりを食う,おいてきぼりをくう,exp v5u,v5,2,to be left behind,2102410
置いてきぼりを食らう,おいてきぼりをくらう,exp v5u,v5,1,to be left behind,2140140
置いて行く,おいていく,exp v5k-s,v5,1,to leave behind,2830507
置きなさい,おきなさい,exp uk,,1,"do (in preparation) (imperative form, after -te form of verb)",2068730
置きに,おきに,exp suf uk,,2,"repeated at intervals every other (day, week, month, ...)",2084550
置けばいい,おけばいい,exp adj-ix uk,,1,it's OK to ... it's best to ... it's alright to ...,2827915
置けば良い,おけばよい,exp adj-i uk,adj-i,1,it's OK to ... it's best to ... it's alright to ...,2827916
置けば良かった,おけばよかった,exp uk,,1,I wish I had ... I should have ... it would have been better if I had ....,2827917
