0,1,2,3,4,5,6
傷弓之鳥,しょうきゅうのとり,exp n id yoji,,1,(person who is) once bitten twice shy someone who has become overly cautious due to a bad experience,2790370
傷心旅行,しょうしんりょこう,exp n,,1,travel to relieve heartbreak sentimental journey,2738810
働かざるもの食うべからず,はたらかざるものくうべからず,exp,,1,"if man will not work, he shall not eat",2168810
働き通しで,はたらきとおしで,exp,,1,working right on through,1451130
僕ん所,ぼくんとこ,exp n col uk,,1,at my place,1909070
儀礼的無関心,ぎれいてきむかんしん,exp n,,1,civil inattention civil indifference,2830315
儘に,ままに,exp uk,,2,"as (e.g. ""do as one is told"", ""as we age we gain wisdom"") wherever (e.g. ""wherever my fancy took me"")",2409100
優しい声,やさしいこえ,exp n,,1,soft voice,1913130
優しくする,やさしくする,exp vs-i,vs,2,to be kind to to treat kindly,1620000
優るとも劣らない,まさるともおとらない,exp adj-i,adj-i,2,not at all inferior to rival or surpass compare favorably (with),1909440
優るとも劣らぬ,まさるともおとらぬ,exp,,1,not at all inferior to compare favorably (with) being even better than rivalling surpassing,1909450
優位に立つ,ゆういにたつ,exp v5t,v5,2,to dominate to prevail to be superior to to get ahead of to get the upper hand,2795510
優劣つけがたい,ゆうれつつけがたい,exp,,2,it's hard to choose (because both are excellent),2108410
優勝を争う,ゆうしょうをあらそう,exp v5u,v5,1,to contend for victory,1913740
儲かりまっか,もうかりまっか,exp uk osb,,1,Are you making money?,2222850
儲け付くで,もうけづくで,exp,,2,for investment to make money,1605090
元が掛かる,もとがかかる,exp v5r,v5,2,to be expensive to cost much,1912510
元にして,もとにして,exp uk,,1,based on derived from building on beginning with,2826770
元に戻す,もとにもどす,exp v5s,v5,2,to go back to the start to reset to restore to return to the point (of a discussion) to return something (that has been moved) to previous place to reconstitute,1980170
元の木阿弥,もとのもくあみ,exp,,3,ending up right back where one started,1260690
元の鞘に収まる,もとのさやにおさまる,exp v5r,v5,3,to bury the hatchet to make up to be reconciled to be reunited (e.g. couple) to be reinstated,2153080
元は,もとは,exp,,4,originally,1912570
元も子もない,もともこもない,exp,,3,losing everything coming to nothing having lost the interest and the principal,2078990
元を取る,もとをとる,exp v5r,v5,2,to recover a cost to recover an expense to get a return on one's investment to get one's money's worth,2731040
元を辿る,もとをたどる,exp v5r,v5,2,to trace back to (the origins of something),2609450
元値が切れる,もとねがきれる,exp v1,v1,1,to be below the cost to sell below cost,1642190
元弘の乱,げんこうのらん,exp n,,2,Genkō War (1331-1333) Genkō Incident,2833511
元弘の変,げんこうのへん,exp n,,2,Genkō Incident (1331-1333) Genkō War,2833512
元気が出る,げんきがでる,exp v1,v1,2,to feel uplifted to be cheered up to hearten to be inspired to be energized,2788810
元気を付ける,げんきをつける,exp v1,v1,3,to encourage to give courage to,1874550
元気を出す,げんきをだす,exp v5s,v5,2,to cheer up (often used with command or request form addressing someone else),2101410
元気出して,げんきだして,exp,,1,keep up your strength chin up!,2062170
元気出せよ,げんきだせよ,exp,,1,lighten up! cheer up!,2062180
兄たり難く弟たり難し,けいたりがたくていたりがたし,exp,,1,there is little to choose between the two they're both about the same,1636770
兄弟牆に鬩ぐ,けいていかきにせめぐ,exp v5g,v5,1,sibling rivalry quarrel among friends,2175450
兄貴分,あにきぶん,exp,,2,like one's older brother,2412960
兄貴風を吹かす,あにきかぜをふかす,exp v5s,v5,2,to act patronizingly,2102050
充血した目,じゅうけつしため,exp n,,3,inflamed eyes,1334320
先が見える,さきがみえる,exp v1,v1,1,to have foresight to be able to see the future,2401570
先ずは,まずは,exp uk,,4,first of all to begin with,2829815
先だって,さきだって,exp,,8,prior to in advance of,1388100
先に立つ,さきにたつ,exp v5t vi,v5,7,to lead to take the initiative,2541030
先に通す,さきにとおす,exp v5s,v5,1,to let (a person) pass first,1878560
先に進める,さきにすすめる,exp v1 vt,v1,1,to proceed with to continue with to move on to go forward to pursue,2830293
先のことは分からない,さきのことはわからない,exp,,1,one never knows (what will happen) there's no telling (what the future holds),2761670
先の日,さきのひ,exp n-adv,,4,the other day a few days ago,1387320
先の話,さきのはなし,exp n,,1,a long way off matter for the future not going to happen anytime soon,2747630
先を争って,さきをあらそって,exp,,2,fighting to be first scrambling to take the lead,2266270
先を急ぐ,さきをいそぐ,exp v5g,v5,2,to hurry to hasten,1980860
先を越される,さきをこされる,exp v1,v1,3,to be scooped by,2530710
先を越す,さきをこす,exp v5s,v5,3,to take the initiative to forestall to beat to the punch,1889120
先んずれば人を制す,さきんずればひとをせいす,exp id,,2,"First come, first served",2418670
先例に倣う,せんれいにならう,exp v5u,v5,3,to follow precedent,1388720
先入れ,さきいれ,exp,,2,first in,2087480
先入れ先出し,さきいれさきだし,exp comp,,2,"first in, first out FIFO",2087460
先出し,さきだし,exp,,1,first out,2087470
先取点を挙げる,せんしゅてんをあげる,exp v1,v1,1,to score the first point,1888810
先延ばしにする,さきのばしにする,exp vs-i,vs,2,to delay to put off to procrastinate,2098640
先手を取る,せんてをとる,exp v5r,v5,3,to take the initiative,1387840
先手を打つ,せんてをうつ,exp v5t,v5,6,to forestall to beat to the punch to anticipate,1387850
先手必勝,せんてひっしょう,exp yoji,,3,victory goes to the one who makes the first move being quick to take action leads to victory the early bird gets the worm,2031680
先方,さきがた,exp,,1,a little while ago,2464030
先生に就く,せんせいにつく,exp v5k,v5,1,to study under (a teacher),1888890
先見の明,せんけんのめい,exp n,,3,foresight prescience,1387520
先輩後輩,せんぱいこうはい,exp,,1,seniority-based hierarchy,2105750
先輩面をする,せんぱいづらをする,exp vs-i,vs,3,to put on an air of seniority,2116010
先輩風を吹かす,せんぱいかぜをふかす,exp v5s,v5,2,to put on a patronizing air,1889050
先頭を切る,せんとうをきる,exp v5r,v5,2,to go first to take the lead to lead the way,2766920
光る棒,ひかるぼう,exp n,,1,glowstick neon light stick,2145320
光を放つ,ひかりをはなつ,exp v5t,v5,2,to shed light to cast light,2401900
光を通す,ひかりをとおす,exp v5s,v5,2,to allow light to pass through to shine light through,1903480
光線を遮る,こうせんをさえぎる,exp v5r,v5,1,to intercept the light,1875300
光輝有る,こうきある,exp,,2,brilliant shining splendid glorious,1874910
光陰矢のごとし,こういんやのごとし,exp,,3,time flies like an arrow time and tide wait for no man life is short,1272860
免じて,めんじて,exp,,2,in deference to in light of considering,1533060
兎角亀毛,とかくきもう,exp Buddh obsc yoji,,2,horns on rabbits and fur on turtles (used as a metaphor for things that do not exist),2179250
党の枠,とうのわく,exp n,,1,party lines (politics),2727350
入るを計りて出ずるを制す,いるをはかりていずるをせいす,exp proverb,,1,Cut your coat according to your cloth,2419300
入るを量りて出ずるを為す,いるをはかりていずるをなす,exp proverb,,1,consider your income before spending,2108430
入れ子にする,いれこにする,exp vs-i comp,vs,1,to nest,2380500
入れ食い,いれぐい,exp,,3,(fish) biting at every cast,2011460
入場お断り,にゅうじょうおことわり,exp,,1,No Admittance,1466370
入札を与える,にゅうさつをあたえる,exp v1,v1,1,to make a bid (e.g. at an auction),2218770
全うする,まっとうする,exp vs-i,vs,604,to accomplish to fulfill to carry out,1641140
全か無かの法則,ぜんかむかのほうそく,exp n med,,2,all-or-none law,2225850
全くする,まったくする,exp vs-i,vs,1,to accomplish to fulfill to carry out,2261740
全くのところ,まったくのところ,exp uk,,2,entirely,1394810
全くもう,まったくもう,exp int uk,,1,good grief (expression of exasperation),2122570
全くもって,まったくもって,exp uk,,4,as a matter of fact really truly entirely completely wholly perfectly,1394820
全体で,ぜんたいで,exp,,3,in all,1395670
全体として,ぜんたいとして,exp,,5,overall,1395680
全力を尽くす,ぜんりょくをつくす,exp v5s,v5,2,to do one's best to put forth every effort,2831547
全力を挙げる,ぜんりょくをあげる,exp v1,v1,2,to use all one's strength (ability),2188220
全員無事,ぜんいんぶじ,exp yoji,,1,Everyone is safe (all right),2048640
全日本,ぜんにほん,exp,,2,All-Japan,1957310
全権を委ねる,ぜんけんをゆだねる,exp v1,v1,2,to entrust (a person) with power of attorney (to do something for one),1889250
全然気にならない,ぜんぜんきにならない,exp adj-i,adj-i,2,not be concerned about at all not mind about at all not care a bit,2563720
全艦撤退,ぜんかんてったい,exp obsc,,1,All ships retreat (military command) complete ship withdrawal,2443300
全速前進,ぜんそくぜんしん,exp,,1,Full speed ahead! Full steam ahead!,2784470
八々,はっぱ,exp,,1,eight times eight,2816800
八幡知らず,やわたしらず,exp,,4,labyrinth maze,1476950
八方丸く治まる,はっぽうまるくおさまる,exp v5r,v5,1,to find a solution (after struggle),1477030
八方手を尽くす,はっぽうてをつくす,exp v5s,v5,1,to try all possible means,2184580
八月大名,はちがつだいみょう,exp,,1,the 8th month has the least work for farmers,2775890
八百万の神,やおよろずのかみ,exp n Shinto,,2,all the gods and goddesses all the deities,2658120
八紘一宇,はっこういちう,exp n yoji,,5,universal brotherhood all eight corners of the world under one roof,1476750
公にする,おおやけにする,exp vs-i,vs,3,to make public,2158500
公の施設,おおやけのしせつ,exp n,,2,public facility,2630040
公の秩序,おおやけのちつじょ,exp n law,,2,public order public policy,2831757
公共の福祉,こうきょうのふくし,exp,,3,public welfare,2620700
公民権停止,こうみんけんていし,exp n,,2,deprivation of civil rights suspension of civil rights,2811620
公益を図る,こうえきをはかる,exp v5r,v5,2,to labor (labour) for the public good to work for the public good,1874760
公知の事実,こうちのじじつ,exp n,,1,common knowledge well-known fact public knowledge,2813030
公言してはばからない,こうげんしてはばからない,exp adj-i,adj-i,1,having no hesitation in stating having no hesitation in declaring,2101090
六十の手習い,ろくじゅうのてならい,exp id,,3,Never too late to learn,2420160
六波羅攻略,ろくはらこうりゃく,exp n,,1,"Battle of Rokuhara (Genkō War, 1333) Capture of Rokuhara",2833515
共にする,ともにする,exp vs-i,vs,4,to do together to share to participate in,2654170
兵を向ける,へいをむける,exp v1,v1,1,to send an army to send soldiers to dispatch troops,1907370
兵を挙げる,へいをあげる,exp v1,v1,2,to raise an army,1907360
兵役逃れ,へいえきのがれ,exp n,,2,evading military service draft dodging draft evasion,2642760
其の時は其の時,そのときはそのとき,exp id,,1,We'll think about it when the time comes,2418800
其の晩,そのばん,exp,,1,over the course of the evening,2714980
其の筈,そのはず,exp n uk,,3,only natural no wonder as expected of course as it should be,2712130
其の罪を憎んで其の人を憎まず,そのつみをにくんでそのひとをにくまず,exp proverb,,1,"condemn the offense, but not the offender detest the sin, but weep for the sinner",2712090
其の際,そのさい,exp adv,,1,in so doing when you do so in this regard on this occasion some time during that period,2819230
其れから,それから,exp uk,,611,and then after that,1006980
其れでこそ,それでこそ,exp uk,,2,quintessential point what one expects Attaboy!,1406040
其れでは,それでは,exp uk,,611,well then ...,1406050
其れなし,それなし,exp uk,,1,without that,2426320
其れなればこそ,それなればこそ,exp uk,,1,for that very reason,2426310
其れに引き替えて,それにひきかえて,exp,,1,in contrast on the contrary on the other hand,2813400
其れはそうと,それはそうと,exp uk,,2,by the way incidentally,1982230
其れはそうとして,それはそうとして,exp uk,,2,be that as it may,2593830
其れまで,それまで,exp uk,,5,until then till then up to that time,1629890
其れも其のはず,それもそのはず,exp conj uk,,3,no wonder little wonder after all as expected which isn't surprising,2678440
其れ処,それどころ,exp adj-no uk,,3,(usu. before a verb in negative form) (not) so much (not) that much,2433200
其処彼処,そこかしこ,exp uk,,3,here and there everywhere,2060150
兼ねない,かねない,suf exp uk,,2,quite capable of ... might happen not unlikely to,1922120
内の人,うちのひと,exp n,,3,my husband one's family,1634460
内の会社,うちのかいしゃ,exp n,,1,our company,1860270
内助の功,ないじょのこう,exp n,,2,"fruits of one's wife's labour (in assisting her husband's career, e.g. by running the household)",2811590
内容が貧弱,ないようがひんじゃく,exp n adj-na,,1,lacking substance poor in content,2829195
内疎外親,ないそがいしん,exp yoji,,1,superficially cordial but actually uninterested,2396460
内縁の夫,ないえんのおっと,exp n,,1,de facto husband common-law husband,2828211
内面の自由,ないめんのじゆう,exp n,,1,freedom of thought,2732200
円で囲む,まるでかこむ,exp v5m,v5,2,"to enclose (a word, letter, symbol, etc.) with a circle",1909800
円を成す,えんをなす,exp v5s,v5,2,to form a circle,1861700
円を描く,えんをえがく,exp v5k,v5,3,"to make a circle (e.g. draw, paint, describe, walk, drive, etc.)",1861680
円滑にする,えんかつにする,exp vs-i,vs,2,to smooth to harmonize to facilitate to streamline,2426790
再帰的に呼ぶ,さいきてきによぶ,exp v5b comp,v5,1,to call recursively,2357380
冒険旅行,ぼうけんりょこう,exp n,,2,adventure travel adventuresome trip safari,2683180
冗談が過ぎる,じょうだんがすぎる,exp v1,v1,3,to carry a joke too far,1886080
冗談じゃない,じょうだんじゃない,exp,,1,Gimme a break! Sod that!,2403910
冗談に紛らす,じょうだんにまぎらす,exp v5s obsc,v5,1,to pass (something) off as a joke,1886090
冗談めかして,じょうだんめかして,exp,,1,jokingly in the form of a joke,2055660
冗談を飛ばす,じょうだんをとばす,exp v5s,v5,1,to crack a joke to tell a joke,2773750
写真を写す,しゃしんをうつす,exp v5s,v5,2,to photograph to take a picture,1881680
写真を撮る,しゃしんをとる,exp v5r,v5,4,to take a picture,1881690
冠を付ける,かんむりをつける,exp v1,v1,1,to put on a crown,1867900
冠を曲げる,かんむりをまげる,exp v1 id,v1,3,to become displeased to get stubborn,1210240
冥冥の裡,めいめいのうち,exp,,1,unawares before one is aware,2671150
冥利がつきる,みょうりがつきる,exp v1,v1,1,to be frowned upon by Fortune,2129340
冥利に尽きる,みょうりにつきる,exp v1,v1,2,to get more blessing than one deserves,2129330
冥加に余る,みょうがにあまる,exp v5r,v5,3,to receive too many blessings to be excessively favoured to be too good for,2582620
冥土の土産,めいどのみやげ,exp n,,2,pleasant memory to take to the afterlife good memory something that makes one feel one can die in peace,2659480
冬の大三角,ふゆのだいさんかく,exp n astron,,1,Winter Triangle (asterism),2833348
冬来たりなば春遠からじ,ふゆきたりなばはるとおからじ,exp,,1,If Winter comes can Spring be far behind?,2212350
冱え冱えとした,さえざえとした,exp adj-f,,1,cheerful (look) healthy (complexion),1297085
冴えない,さえない,exp adj-i,adj-i,10,dark dull sullen,2576510
冴え冴えした,さえざえした,exp adj-f,,3,cheerful (look) healthy (complexion),1297080
冷たい戦争,つめたいせんそう,exp n,,8,cold war the Cold War,1894990
冷たい暗黒物質,つめたいあんこくぶっしつ,exp n,,3,cold dark matter,2606970
冷や飯を食う,ひやめしをくう,exp v5u id,v5,3,to depend on somebody for food and lodging,2118990
冷暖自知,れいだんじち,exp Buddh yoji,,1,spiritual enlightenment only comes through personal experience,2822390
冷静になる,れいせいになる,exp v5r,v5,2,to collect oneself to chill out to cool off to recover oneself,2557400
凄くない,すごくない,exp uk,,1,cool! (only when said or written in a questioning tone) incredible unbelievable,2057020
凄みを利かす,すごみをきかす,exp v5s,v5,2,to threaten to intimidate,2678430
凄みを利かせる,すごみをきかせる,exp v1,v1,3,to threaten to intimidate,2678420
凝然として,ぎょうぜんとして,exp,,2,quietly without the slightest movement,1239200
凡事徹底,ぼんじてってい,exp yoji,,1,do your best give it your all,2829677
処し方,しょしかた,exp,,2,way of dealing with way of handling,2601730
凶弾に斃れる,きょうだんにたおれる,exp v1,v1,1,to be shot to death by an assassin,1870230
凹き所に水溜まる,くぼきところにみずたまる,exp proverb obsc,,1,someone in bad circumstances will continue to accumulate difficulties,2832798
出かした,でかした,exp uk,,2,well done good job,2757690
出して呉れる,だしてくれる,exp v1-s,,1,"to take out (e.g. garbage) to put out (e.g. dishes on table) to serve (e.g. meal) to get out (e.g. food from cupboard) to submit (e.g. ideas, opinions) to provide for to pay for to foot the bill",2216000
出しにする,だしにする,exp vt vs-i,vs,2,to use as a pretext to use as an excuse for doing something,1337980
出しに使う,だしにつかう,exp v5u,v5,2,to use as a pretext to use as an excuse for doing something,1337990
出す事は舌を出すも嫌い,だすことはしたをだすもきらい,exp obsc proverb,,1,being exceptionally stingy,2178680
出たとこ勝負,でたとこしょうぶ,exp n,,4,leaving a matter to chance,1338190
出てお出で,でておいで,exp,,1,come out! where are you?,2725150
出る前,でるまえ,exp n,,1,before going out,1338250
出る幕ではない,でるまくではない,exp,,1,it is none of one's business it is not one's place to say (do) something,2126140
出る所に出る,でるところにでる,exp v1,v1,2,"to go wherever one has to go (to get a matter settled, e.g. the court)",2126130
出る杭は打たれる,でるくいはうたれる,exp v1,v1,4,the nail that sticks out gets hammered in the best policy is to keep your head down,1985430
出る釘は打たれる,でるくぎはうたれる,exp v1,v1,4,the nail which sticks out gets hammered down (used to encourage conformity),1338260
出席を取る,しゅっせきをとる,exp v5r,v5,2,to call the roll to take attendance,2769400
出来が悪い,できがわるい,exp adj-i,adj-i,3,(having) bad marks or results (e.g. in school),2426270
出来ちゃった結婚,できちゃったけっこん,exp n,,3,marriage due to unintended pregnancy shotgun wedding,1340440
出来っこない,できっこない,exp uk,,1,can never be able to,2063900
出来るだけ,できるだけ,exp uk,,709,as much as one can as much as possible if at all possible,1340460
出来るようになる,できるようになる,exp v5r uk,v5,1,(something) has become possible (something) is now possible,1008400
出来る限り早期,できるかぎりそうき,exp n,,2,as soon as possible ASAP,1340480
出来れば,できれば,exp uk,,3,if possible,2825960
出来得る限り,できうるかぎり,exp,,1,as (much) as possible as (far) as possible,2426630
出欠を取る,しゅっけつをとる,exp v5r,v5,3,to take a roll call,2403030
出物腫れ物所嫌わず,でものはれものところきらわず,exp id,,1,Necessity knows no law,2417860
出立て,でたて,exp,,3,right after coming out,1778890
出藍の誉れ,しゅつらんのほまれ,exp n,,2,surpassing one's master,1853970
出鼻をくじく,でばなをくじく,exp v5k,v5,2,to spoil someone's start to kill someone's enthusiasm to take the wind out of someone's sails,2684060
刀を差す,かたなをさす,exp v5s,v5,2,to wear a sword,1865770
刀を帯びる,とうをおびる,exp v1,v1,1,to wear a sword,1897220
刀を打つ,かたなをうつ,exp v5t,v5,2,to temper a sword to forge a sword,1865760
刀折れ矢尽きて,かたなおれやつきて,exp,,1,having exhausted every available means having broken one's sword and exhausted one's arrows,2122110
刀折れ矢尽きる,かたなおれやつきる,exp id,,2,It's all over now,2419140
刃を交える,やいばをまじえる,exp v1,v1,2,to cross swords (with),1912840
刃傷に及ぶ,にんじょうにおよぶ,exp v5b,v5,3,to come to bloodshed,2112180
分からん,わからん,exp col,,2,I don't know,2168120
分かり切った,わかりきった,exp,,4,obvious undeniable,1502950
分かんない,わかんない,exp adj-i col,adj-i,2,not understanding not knowing,2158960
分が悪い,ぶがわるい,exp adj-i,adj-i,2,at disadvantage having no edge having poor prospects,1622080
分が薄い,ぶがうすい,exp,,1,thin,1906760
分けいい,わけいい,exp adj-ix,,1,easy to divide,2827400
分け良い,わけよい,exp adj-i,adj-i,2,easy to divide,1503100
分の,ぶんの,exp suf,,1,-th (e.g. one fifth),2145670
分の悪い,ぶのわるい,exp adj-i,adj-i,2,disadvantageous long (odds),2240560
分の１,ぶんのいち,exp suf,,1,"one Nth part (e.g. one fifth, one tenth) one out of N",2269760
分母をはらう,ぶんぼをはらう,exp v5u math,v5,1,to cancel a denominator to clear an equation of fractions,2829589
分秒を争う,ふんびょうをあらそう,exp v5u id,v5,1,there is no moment to lose to fight with every minute and every second,2419670
切った張った,きったはった,exp adj-no,,1,violent (fight) slashing and striking hand-to-hand,2784490
切っては切れない,きってはきれない,exp adj-i,adj-i,2,inseparable,2583560
切っても切れない,きってもきれない,exp adj-i,adj-i,1,"inseparable (esp. bond, relationship) inextricable joined at the hip integral essential cannot be broken (cut, separated) indissoluble",2117930
切っ掛けに,きっかけに,exp uk,,1,with ... as a start taking advantage of inspired by,2034320
切に勧める,せつにすすめる,exp v1,v1,2,to urge strongly,1888480
切りがない,きりがない,exp adj-i uk,adj-i,605,endless boundless innumerable,1383810
切りのない,きりのない,exp adj-i uk,adj-i,5,endless boundless,1383840
切り捨てられる,きりすてられる,exp v1,v1,1,can be discarded can be cut down,2368890
切れが悪い,きれがわるい,exp adj-i,adj-i,2,thick dull (blunt) viscous,1870840
切れ目のない,きれめのない,exp adj-pn,,1,seamless contiguous unbroken non-stop,2830433
切れ目を入れる,きれめをいれる,exp v1,v1,1,to make a cut to make an incision to score (food),2833505
切手を溜める,きってをためる,exp v1,v1,2,to collect stamps,1869240
切磋琢磨し合う,せっさたくましあう,exp v5u,v5,2,to work hard together to be in a state of friendly rivalry,2397000
切符を切る,きっぷをきる,exp v5r,v5,2,to rip off a coupon to punch a ticket,1869270
切符を取る,きっぷをとる,exp v5r,v5,1,to buy an advance sales ticket (for a reserved seat),2179650
切符を改める,きっぷをあらためる,exp v1,v1,1,to examine tickets,1869260
刈り立て,かりたて,exp,,1,new mown newly cut (hair),1209530
刎頚の友,ふんけいのとも,exp n,,2,inseparable friend sworn friend,2801350
刎頸の交わり,ふんけいのまじわり,exp n,,3,inseparable friendship,2801330
刑に処する,けいにしょする,exp vs-s,vs,1,to sentence to assign a penalty,2410980
列を作る,れつをつくる,exp v5r,v5,2,to form a line (row),1916600
列を成す,れつをなす,exp v5s,v5,2,to form a line to queue up to line up,2791940
初めから,はじめから,exp,,3,from the beginning,1307510
初めとする,はじめとする,exp vs-i uk,vs,1,commencing with including,2420390
初めに,はじめに,exp,,610,first firstly first of all to begin with in the beginning at the beginning,1307520
初めまして,はじめまして,exp uk,,4,How do you do? I am glad to meet you,1625780
初午,はつうま,exp,,5,"first ""horse day"" in any lunar month, but esp. the second lunar month traditional day for worship at ""fox deity"" shrines",2534010
初心忘るべからず,しょしんわするべからず,exp id,,3,Don't forget your first resolution,2417880
初日が出る,しょにちがでる,exp v1 sumo,v1,3,to achieve one's first victory after a string of losses,2572520
初日の出,はつひので,exp,,3,first sunrise (of New Year),1343000
初日を出す,しょにちをだす,exp v5s sumo,v5,1,to achieve one's first victory after a string of losses,2024430
初期のころ,しょきのころ,exp adj-no,,2,the earliest,2538810
